{
  "schema_version": "1.0",
  "stage": "publish",
  "run_id": "fixture",
  "generated_at": "2026-08-11T10:14:50Z",
  "agent": { "model": "gpt-5-codex", "charter_sha": "fixture", "attempt": 1 },
  "decisions": [
    {
      "story_id": "st_recycled_renders",
      "concept_id": "cp_rr_copier",
      "decision": "approved",
      "decided_at": "2026-08-11T10:09:22Z",
      "decided_by": "column editor (fixture)",
      "editor_note": "Running this. Take draft 1 — the second has better weight but the banner needs clearing. Use the one-word caption.",
      "brief_path": "out/BRIEF-1.md"
    },
    {
      "story_id": "st_night_vote",
      "concept_id": "cp_nv_theatre",
      "decision": "revision_requested",
      "decided_at": "2026-08-11T10:12:40Z",
      "decided_by": "column editor (fixture)",
      "editor_note": "Agree with the gate on the lettering. Also hold it a day — if the committee reconvenes properly this week the joke gets better, and if it doesn't, that is the story."
    }
  ],
  "ledger_appended": ["lg_fixture01"]
}
